# Unified curated and Vahan-bundle event timeline; possible_overlap flags collisions.
bundle:A34,2024-05,2024-09,AP,policy,policy,2,AP Government Change + Amaravati Revival,AP state elections May 2024: YSRCP replaced by TDP-led NDA alliance. Government fleet procurement paused during transition. TDP reinstated Amaravati as capital city (Jun 2024) — CV (construction vehicles) and infrastructure demand revival. Temporary Q2 2024 all-segment dip followed by recovery. EV Bus procurement under AP EV Policy accelerated under new government.,AP election results May 2024; AP Cabinet order Jun 2024 Amaravati; FADA AP monthly,reported,vahan_bundle,False
bundle:A22,2024-10,2024-12,ALL,subsidy,subsidy,2,"PM E-DRIVE Scheme — ₹10,900 Cr","PM Electric Drive Revolution in Innovative Vehicle Enhancement scheme approved October 2024 with ₹10,900 Cr allocation. Covers EV 2W, 3W, buses with ₹13,000–15,000/kWh subsidy for 4W EVs. Stronger signal than EMPS — larger budget, longer horizon.",PIB Oct 2024; MHI PM e-DRIVE notification; SMEV,reported,vahan_bundle,True
curated:PMEDRIVE,2024-10,2024-10,ALL,subsidy,subsidy,2,PM E-DRIVE begins,Rs 10.9k cr; no private e-car purchase subsidy; charging infra push,MoHI,official,curated_reference,True
bundle:A14,2025-07,2025-12,ALL,regulation,regulation,1,GST 2.0 — Comprehensive Vehicle Rate Rationalisation,GST Council's comprehensive rate rationalisation (July 2025) reduced effective GST burden on vehicles. All segments benefitted. Demand stimulation visible in Q2–Q4 2025 registrations. Effect strongest in mid-size segment where the cess reduction was largest.,GST Council Jul 2025; PIB; SIAM post-GST 2.0 data,reported,vahan_bundle,False
curated:GST2,2025-09,2025-09,ALL,tax,tax,2,GST 2.0 rate rationalisation,Small cars moved to 18% slab (from 28%+cess); large cars 40% flat,GST Council,official,curated_reference,False
